{
  "$schema": "https://json-schema.org/draft/2020-12/schema",
  "$id": "https://zyzhixi.github.io/MediaFontsPacked/schema/template.schema.json",
  "title": "MFP preview template",
  "description": ".mfp 预览模板文件（templates/<templateId>.json）的结构定义，对应 SPEC.md 第 4.5 节与 10.5 节",
  "type": "object",
  "required": ["templateId", "canvas", "textLayers"],
  "additionalProperties": true,
  "properties": {
    "templateId": { "type": "string", "minLength": 1 },
    "name": { "type": "string" },
    "canvas": {
      "type": "object",
      "required": ["width", "height"],
      "additionalProperties": true,
      "properties": {
        "width": { "type": "integer", "minimum": 1, "maximum": 4096 },
        "height": { "type": "integer", "minimum": 1, "maximum": 4096 },
        "background": { "type": "string", "pattern": "^#[0-9A-Fa-f]{6}([0-9A-Fa-f]{2})?$" }
      }
    },
    "textLayers": {
      "type": "array",
      "minItems": 1,
      "items": {
        "type": "object",
        "required": ["text", "fontSize", "x", "y"],
        "additionalProperties": true,
        "properties": {
          "id": { "type": "string" },
          "text": { "type": "string" },
          "fontSize": { "type": "number", "exclusiveMinimum": 0 },
          "color": { "type": "string", "pattern": "^#[0-9A-Fa-f]{6}([0-9A-Fa-f]{2})?$" },
          "x": { "type": "number" },
          "y": { "type": "number" },
          "align": { "enum": ["left", "center", "right"] },
          "baseline": { "enum": ["top", "middle", "bottom", "alphabetic"] }
        }
      }
    },
    "decorations": {
      "type": "array",
      "items": {
        "type": "object",
        "required": ["type", "x", "y", "width", "height"],
        "additionalProperties": true,
        "properties": {
          "type": { "enum": ["rect"] },
          "x": { "type": "number" },
          "y": { "type": "number" },
          "width": { "type": "number", "minimum": 0 },
          "height": { "type": "number", "minimum": 0 },
          "fill": { "type": "string" }
        }
      }
    },
    "fallback": {
      "type": "object",
      "additionalProperties": true,
      "properties": {
        "text": { "type": "string" },
        "fontSize": { "type": "number", "exclusiveMinimum": 0 },
        "color": { "type": "string" }
      }
    }
  }
}
